<?xml version="1.0" encoding="UTF-8"?>
<schema xmlns="http://www.w3.org/2001/XMLSchema" targetNamespace="http://www.example.org/Book" xmlns:tns="http://www.example.org/Book" elementFormDefault="qualified">

    <element name="Book" type="tns:book"></element>

    <complexType name="NewType"></complexType>

    <complexType name="book">
    	<sequence>
    		<element name="title" type="string" maxOccurs="1" minOccurs="1"></element>
    		<element name="author" type="string" maxOccurs="unbounded" minOccurs="1"></element>
    		<element name="genre" type="tns:Genre" maxOccurs="1"
    			minOccurs="1">
    		</element>
    		<element name="additionalInformation" type="string" maxOccurs="1" minOccurs="0"></element>
    		<element name="quantity" type="int" maxOccurs="1" minOccurs="1"></element>
    		<element name="price" type="float" maxOccurs="1" minOccurs="1"></element>
    	</sequence>
    </complexType>

    <complexType name="Genre">
    	<sequence>
    		<element name="type" type="string"></element>
    	</sequence>
    </complexType>
</schema>